0.5319982934914658,LOL...Why are you wasting your time reading the comments?
0.5329735445451087,All Yall Bitches On Here Sayin She Deserved That Yall Dumb Is Hell Yall Must Like Getting Hit By Niggas
0.5341263155421628,With this attitude you must be liked veru much by your little students :
0.5964787116970977,I LOVED HIS CLEAN CUT DICK HOPED I AM THERE TO SUCK IT AND LICK AND ALLOW HIM TO FUCK ME...
0.5082284183068421,It is it has his fucking fault for not understanding that is that has who he was fucking dealing with.
0.6390478896298853,KD COME THE FUCK ON YOU HAVE THAT JORDAN'S BLOOD COME ON
0.5856394150739335,YES you are awitin.
0.5479060882437643,sexyred .....  you are right ....  time to move on .....
0.5102529046221402,Unless your name is actually Shatner your comment is pretty ironic.
0.5132871119750413,This is a good shirt to wear if you want the shit kicked out of you while bleeding from every orifice and sporting an atomic wedgie.
0.7033537566468467,Nobody gives a damn what you want crybaby.
0.5558970517042688,damn i had to watch this shit again.......3 weeks LATER
0.560139531709743,@JoshXdLo ano @MAFYOSO if you give me your email i will email it to you if you do not have it on your idevice\ \
0.7544542866303263,morons like you do
0.6577297390459249,Hi Nana...How are you today?
0.5099163272051415,pedophilia is no more rampant in gays than it is in heteros do some research so you dont sound so much like a bigoted douche
0.5090417560414778,Oh Lego videos how simplistic yet watchable you are.
0.5461845576190665,FUCK OF BLANKY FACE THIS WORLD IS GOING UP IN FLAMES!!!!!!
0.7050937394477136,@gregadeaux  that guy deserves a fucking medal.
0.6248088201857714,@Hobbes83 Blow it out your arse who died and made YOU boss?
0.6312312106651783,who is who has this ugly bitch?
0.6358515373450897,: O. r u fuckin kidding me?
0.6377922370494895,Your  hunch  is probably correct....
0.6040440942230024,We are watching you as you watch us!
0.5575070692715706,what a nerd. you would get your ass kicked by a black guy if you used that word in front of him.
0.5470377359479976,I will i shall be watching you... from your closet
0.5305370597959052,You are going to blow a gasket you are SO jealous!
0.5389252974988655,Jamey you aint kidding!
0.5169472951501751,JMen who are you talking about never hoida him.
0.7222500600358597,You do not play competitive sports do you?
0.5137209121199358,@TinaDexler I know you are still here.  Why will not you answer my questions.  You got awfully silent.
0.6333991190405348,Hell yeagh man kluv these hot pig fukkas luv to get over and do the same wiht you man You sound fuckin hot!
0.6252773557070416,video's the SHIT...who you think you are Albert Einstein ....LOVE IT
0.5869715318006917,YES. OH MY FUCKING GOD.  THEY'RE BACK.  THEY'RE FUCKING BACK.  Excuse me while I go drown in my pool of tears.
0.9928589583335674,fuck
0.6769095353864234,what in the fuckkkkkkkkkkkkkkkkkkkkkkkkkkkkkkkkkkkkkkkkkkkkkkkkkkk
