0.5245958313675446,How about we accept facts and patiently wait for you to back up your claim.
0.5485972048391268,CNN supports HARCORE MASS MURDERING ISLAMIST TERRORISTS!!!!     Don 19t ever forget this guys!
0.6057951822163844,What is your problem AW
0.641810874943153,Richards passes it to Carter.  Wow.  Surprising
0.7500238483642262,yeah!!!! fuck undying!
0.5373572775007447,nah...that'd be your daughter
0.6082307992402732,So perfect!  LOVE to suck you!!!
0.5304215994233766,And you can be silly too!
0.7209744953293153,Start with impeaching this dumb ass usurper
0.5478519721861885,Who ever the fuck is going around saying I suck dick better run for their life. Imma set my dog on their ass.
0.539753748262808,You are far too generous in your comment about the odious Hamish Meldrum.
0.5639614070886945,WFHASDLGASEGFEAWOHDSHFLAWEFSDHF..SFOAWEHGASD HOLY FUCK.. DPIAHSGPA..I CAN'T EVEN ..  61   THE RETURN OF THE SUPERIOR. 13 2 FOREVER
0.527660683904722,Because you troll to much.
0.5718973070103092,You must have a very hot temper. I see you are losing your temper because you cannot stand the truth?
0.8581152500054241,Holy shit you are right!
0.7191327351688964,Yours is jacked
0.9842605873161149,how fucking DOPE
0.8133562056609206,Fuck this show .
0.5108649054896466,What a piece of crap you know he will screw wawa or anybody else to make a nickle
0.6397987296972089,Your comment shows how absolutely little you know
0.5975055979378877,Thank you very much
0.6550422790107899,Somebody owes you a refund.
0.9283547046944192,FUCK ALL U PUSSY AS  CRACKERS
0.572969282029284,You ain't a troll bro
0.9193107142267118,I fucking love your username
0.5121284375605777,That is that has one hellaciously gorgeous cock.
0.5065078001259851,You apparently do not watch the celtics floppers lmao
0.5564703441465397,Fucking idiots. They should all be in jail. Make things worse for all of us responsible and respectful cyclists.
0.5286411715109569,Nobody understands why you are a Paulbot probably not even Ron Paul.
0.5027774084216377,Guest I have been reading your post for a whileare you a female?
0.5173078596663372,BBU What are you planting if you do not mind me asking.
0.5130799713507902,Why even enter if you knew you are not good with freestylling w/o your notebooksad thing is lyrically he better than 50% of these bum ass rappers....
0.5051872659375318,Of course he fucking wants Harrison Ford. And Harrison Ford better fucking want him after his last 20 years of choices.
0.5127144889938849,Who the hell are you to judge? Must be one of those who casts the first stone. Your NWO will fail period. You just do not know it yet opps now you do.
0.7416233407391993,Great another one. Really we\ \ do not\ \ need any more of this crap. Your life sucks. People judge you. Good job go tell your mom not the internet. We. Do not. Care. Same with the stupid anti religious\ \  or conversely\ \ religious  posts on dbpb. Okay so you do not think that abortion is bad. Okay then. You do not need to shout it out to the world. Just like you do not think\ \ religion\ \ should exist that it is it has evil ect. Yeah yeah God bless ya we do not need to hear it on this site. All it does it annoy people and start flame wars. Only thing flame wars are good for are to roast marshmallows.\ \ \ Sorry guys I think I am on some sort of man period  . \ \ Off topic: Anyone else love Blackbird by the Beatles?
0.5504117602480387,How dare you say such a hateful thing!
0.7042357084394281,You will you shall be bloody miserable though!
0.5519301998724784,Like you for slander!!
0.6001800490201944,I know you are speechless when you hear the truth.
0.5328540914700532,does not matter who you are you could be jay   or nas or dr dre who ever if you fuck up long enough then do some shit like this your no longer a legend period lol
0.5280018810921875,Check your  ombie Manual. Headshots are the only cure.
0.5018337783224803,Maybe you just did not listen.
0.5111446309123375,@avclub e576423831e043f7928d9ac113abbe6f:disqus   I fucking predicted it last week.  Which means I am better than the showrunner for this show  and so are you!
0.521062360121988,The answer to your question as you are well aware is  no
0.5518584574911367,When you get depressed look at your beautiful water and your beautiful men!
0.5396333540088213,Yeah Japanese game shows are completely outrageous.
0.5154843957937378,@NCSteve 3.0 @dopper0189\ \  If I could dry hump your post I would
0.8947613236612707,What a fucking joke!
0.6444559064059185,I do not think we have a shitty team.
0.5556189951388953,What is what has  fucking pathetic  is considering anything you are politically opposed to as  tyranny.
0.5670109917175792,ac tro gi ma hay va kho the fuck
0.5639247795436779,Thank you again Adam and John.  K bye
0.6439446294134438,Only if you are.
0.5404734254235423,I WOULD LOVE TO HEAR THAT SPEECH.
0.6255458565708651,what are your picks?
0.5124458355745511,butt scales sound like a big problem.  You all should go see your doctors and get treatments for that.
0.5703059652850114,Get rid of this fuckin player pl  so slo
0.6153946157181888,You never saw 'Animal House'?........
0.6628211613657045,ok. Off you go.
0.5540217609330117,Like your pictures.  Follow?
0.8905987553204097,@PassTravelFool suck it republiklans
0.5029905412674132,They are against abortions in the case of rape because Jesus was conceived by God raping Mary.
0.5985239474003448,Nothing like imitating a sex offender for laughs.  Ha ha!  I might be a rapist.  Asshole.
0.609672908267212,Prove your AMERICAN and you can vote all you want.    Get it?
0.5360503025734367,Let me ask you a question.....you like fishticks?
0.5401401250579995,how are you a fan of 3 football teams?
0.6963191149676354,MAN FUCK THE POLICE WE NEED TO START A RIOT ON THEY ASS
0.616137960573963,You go from absurd to moronic.
0.5096058437289396,I was not able to crack JEE when i was young :
0.506106910915222,Like if you are a Rangers fan.
0.6520630920531302,You know because you are an expert drunk?
0.5089917648227994,@faustshausuk sad.  And just like that you fucked up.  Apple....Apple.  You sir need to do some research on your friend Apple when it comes to hardware. LOL!
0.5087467598369961,Repost: I have reread this blog article and feel the need to repost it:   Massacres Never Again  We Will Not Silence
0.5353252562984799,You are just plain wrong.
0.595971816146669,Who do you think assisted him with the Olympics in Salt Lake?
0.617194311769197,lol who are you rooting for??
0.7275280829739527,You seem obsessed with gay sex......seek help
0.5430630172711426,you do not have to comment when you are high !
0.5966063636899289,Maher is an idiot.. and you are too if you defend his stupidity
0.5614762990425619,No matter how old you get she thinks about you and worries....and prays for you.
0.717295068716293,why niggas slappin bitches ass nowadays smh we punchin bootys were im from bruh
0.5779695758474547,One Pimp & One Prostitute both smell very nasty
0.6502066452956778,GO YOU CHICKEN FAT GO!
0.571681219920341,Dre WTF are you doing not even close
0.544529257496237,You know there are people who still have not seen  Prometheus  right? The fucker's only been out for one weekend.
0.5287316354290779,LOL Allen Iverson was right he told Lebron people was gonna hate him.Jealous ass pussy fucks say what you want about him.He is he has in the finals and you are behind a computer scratching   your nuts.Know your place.BTW Okc vs Heat is gonna be a good ass game.
0.5353252562984799,And you are meet example.
0.5036209359718328,Gee Mitch.   As I recall you and Boner would not bargain with the president when he offered a $4 billion deal that would have had a tiny tax increase on the 1%.  You blew it.  I hope you and Boner get driven from office.  You have fucked up the economy for your own greedy political gains.
0.6759729795721376,Oh shit there is there has more !   Fucking perfection lmao !
0.5567053268783275,So much win in your comment
0.5353252562984799,why you gotta trash Cali?
0.5801564887385681,Looks like You Sarah!
0.5969644115883087,GET YOU HEAD OUT OF YOUR    A      !!!!!!!!!!!
0.513943811867838,Have you seen birdsong yet?
0.5516213195091638,An incompetent pos that nobody should be burdened with. Start the criminal proceedings
0.6769095353864234,um..uh...ah shyte never mind...
0.5850907281237021,This is what happens when you fuck dirty dudes you just met at the bowling alley.
0.8841036676200315,Ben Richards have you seen your mom or your granny titties cause she only show a nipple.I guess when your wife gets 60 you will you shall stop looking at her titties too.
0.6152730923783736,To those of you who think defense lawyers are scum   hopefully you will you shall never need one on your side.
0.5012737205985435,Fuck The Great Gatsby.  I am sorry that book sucked ass and the movie will suck even more.   You know what I am NOT sorry. I hate that book as much as fucking Terry Tempest Williams who  whom?  I had to read in college.
0.8273206141642799,Like you?
0.5071648696713452,\ \ well  you piss off black people comparing that to gay marriage  but thats there problem
0.5326795827482581,when you are slaves you do not make demands time for a revolution
0.8472407646339226,you fuck there heads
0.5484831695010842,You do what you gotta do to win and make money
0.6769095353864234,shit its saturday night
0.5611516197418214,you are a funny girl!
0.5273718023404018,Can we please start with the head of the  cl ass?
0.6575440157732093,Do not be a fucking asshole do not strike up awkward conversations with strangers on the subway
0.5360334216134679,by laptop are you referring to the position you have the children assume white Sandusky?
0.5610492886391811,Good job..like your style!
0.5001024826465745,Are you better off now then you were 2 years ago before lepage went into office?
0.577477875242774,There was dancing in the street after 9/11!!    AND WE  THE US  CONTINUE TO GIVE THESE MOTHER FUCKERS MILLIONS  OF DOLLARS AND GUNS!!
0.5525502523655458,Oooh I want that soo bad!  I want to be your fuck toy!
0.5851397919985605,\ \ My 18 year old son says she sucks ass.
0.5467918163574366,You get used to it after a while. You have too.
0.5103552623911091,THAT is one BI ARRE opinion that Roberts fuckingup the Presidential Oath of Office resulted in a Totalitarianism over the USA. LOL have another drink pal.
0.6389724455391166,Man im gna get one of those . And his fucking was hot as shitt     3
0.6648589171611377,Did you force yourself to be straight? If you did you probably are gay.
0.6434670207599203,Fuckkk you dodgers!!! score some frickin runs for fucksake
0.5639213452523579,right.....if republicans were in power NOBODY will be poor.   LMAO
0.5086345841154362,BIG BANG !  3   sorry Katy... i love your music but    LOL fuck it i dont even like your music and never did :D
0.5448078970118757,You hear more comments about the Heat on this forum than you do OKC...LMAO shows who people really fear!
0.583150857944698,hope u and yours are safe tonite Bill
0.5356612278335985,For everyone's sake lets hope you are wrong.
0.5814624515414855,Oh dont be so hard on yourself freddie...youre a smart person...and gosh darn it people like you.
0.5601896506498746,Yes because you and your ilk make it like this.
0.5987002407981622,Ah for fucksake i cannot stand her voice
0.5032840134353083,NAY are you a fan of NASCAR as well?
0.8136958459517586,I am so fucked.
0.7050243357333535,LET HIM FUCKING SHOOT THE BALL!!!! WHY ARE WE CLOSING ON JAMES?
0.5303521664609488,With all due respect you are an idiot. Conservative Liberal either one would raise unholy Hell if their daughter was being assaulted.
0.7284311694624948,Oh girl you got dem shoes..
0.5293848135930544,Did you just place your comment under mine on a whim or do you see a connection?
0.5138617485063708,I cannot wait until all of you realise that you just wasted your money on CoD:Black ops 2
0.6068072239361082,@MiracleMan    Loins Fever does that
0.5104644428363309,@Rourke needs to give me a fucking like nope not a fan of cajun food.
0.8974850483373468,More like faggot.
0.506026677719268,...........BAM....you be FERTILI ER...
0.6125963112997532,Our deepest sympathy to you and your family Katrina. May you find the strength you need in your children xx
0.6721239347705562,\ \ Ignorant ass.
0.8060618150660951,Sasuke thoughts   You burnt my fucking snake now you die.
0.6344325189702189,Arrest all of these scumbags for fraud.
0.9048759773042961,You can take your mom here when you get rich!
0.5583555649948346,Where are you in Syria?
0.5842778288888508,Sounds like your mother.
0.6311258622022579,Hey Burd 52.... Your picture is black and white! And you have glasses on!
0.6396799378402926,so your a liar then
0.5116186854994319,You need to find that post..... if you can. I and others find you to be full of it.
0.6120279024869082,@Rourke needs to give me a fucking like  @aciddragon    Mmmmmm...Babcock!   Heheh. Cock.
0.5161957499033192,@Rourke needs to give me a fucking like  @Preparation A Does wayne brady need to slap a bitch?
0.6439446294134438,You are right on
0.6197551652410024,If you dont respect your body why would you respect anything else ?
0.5803438808071792,I have a sticker you can put on your laptop.
0.529234170265541,Sly appears to have some good ass... Especially in the rawrod scene... where dude fucks that ass royally...
0.5208304207177025,But you are not rich and you do not understand how any of this works.
0.6471454452731578,Oh God arise May your enemies be scattered.
0.5047349300728227,@Fit   you still around?
0.5697033608791251,I hope some of you reali e YOU are the reason young gays  and all ages!  commit suicide.   I hope you can sleep at night   the blood is on your hands.
0.8123344228235772,Abso fuckin lute ly.
0.5133860983354617,You can blame us for your shortcomings all you want but it will not change anything. Why not go talk to your friend and start making amends as early as now?
0.5288385709512042,@jla It just leaves you speechless sometimes.
0.5324761721165148,YOU WERE AED TO STOP FEEDING ....NO SELF CONTROL?
0.6628211613657045,You do not say?
0.7472342795863127,PED's destroy your body.
0.5382904819434309,You are correct about the black hole thing.
0.5025981789521117,Call the vote. Slap this bastard down in front of  his people.  Let this pimp/murderer/punk/liar peddle his toilet papers in Hell.
0.5398264243372844,PRI E WINNER!!!!  DT  lets get immigration mentioned on the most inappropriate thread  competition.  Coming soon:  Homosexuals responsible for water shortage!
0.6377629882719777,''fans'' do not hate you mean haters do not you SJDFSOHGIDUJGBFUCKINGSTUPID?  and what I am living proof that we do not.
0.5540217609330117,Like your pictures.  Follow?
0.6891538192195554,Ah.  Fuck 'em then.
0.573516021089184,I just finished Doom 3 today :P Fucking torch with no gun!
0.5103212506874099,I see you play you little insult games with other posts.
0.5302494974629222,Cat can only catch your tongue when you are advocating what is unwholesome.
0.6318174836884862,I like your comment.
0.6205803716178485,crawled out of your hole after 44 years have you?
0.5568461033393117,Hi ASHLEY. How many screennames do you have?
0.7943653021801782,Listen motherfucker! We only sing 80s Joel!
0.606191363912157,If you do not like yourself why would you expect other people to like you?
0.9862558363682341,Retarded fucking Tide helm.
0.7560511788792924,Infinite thanks for not calling your vulva your vagina.
0.9722959782768933,Fucking slow assed game
0.5406499923181435,How come you are sooooo bad? You do not win ANYTHING????? You must get paid by the books.......
0.5181220724240391,ooo damn you corrected it before I could get it finished.. darn :
0.7189311510074213,Det m  v re en fucking joke!
0.8781637407710303,SNAIL WIVES USE SMALL MOTHERFUCKING KNIVES ON PAUL SMITHES
0.6698332232078863,you should butt out sean you dont even live here
0.5550910283723036,He deliberately brought this to a PvP engagement....  My mind is fucking blown...
0.5017672076392441,Truthbtold87: I somehow doubt very much you are a Yank
0.5673714102727536,What the fuck is hippo? thanks to hell tourism!
0.8944630904164089,det er fucking scary
0.5133569460356561,how many of you gay rights supporters would sign petitions to\ \ legali e adoption only incestuous relationships or consenting polygamous unions?\ \
0.5151116070047421,Wow!! You are so ignorant it is truly sad. You should move to a communist country because only in a backwards ass communist country would your extremist views be accepted. Voters dont matter? Cu  thats what you are saying right? Republikkkans like you are what is wrong with our country not gays and lesbians. At least they have a sense of humor you people are just downright retarded.
0.552932486488282,When you unwrap your reserved copy from Toys 'R Us and put the game in you will you shall find out all of your answers.
0.7769700519266088,FACT: 3 out of 4 pedophile acts are homosexual
0.5185327803745144,wow! you are a well travelled guy^^ did you like London? the weather here really sucks! ugh!
0.5304627413507234,wtf with your  TRUE NBA FANS  do not tell me what to think just because you are pigment challenged
0.5078622584504818,You are a good cutter/paster.
0.5525869793362903,To ascend you must die.
0.5555182162853415,I hope their next tour comes through Dallas again they fucking blew my mind last time they were here.
0.5606834641085775,You will be in stripes before he is.
0.5991119203895532,Would not you just LOVE TO KILL HIM?    WHAT COLOR IS YOUR GUILLOTINE  ?!
0.6250306266614737,Cut your damn finger nails woman.
0.528467741256116,WOW TAKE IT EASY OLD MAN YOU MIGHT GET A HEART ATTACK.
0.5829959265381882,You say Ben is a bad guy you expect nobody to check you out when you make a comment like that.  Seriously?  You are a stooge
0.7142062319678596,Shame on YOU.  Where were you when Perry was abusing her asshole.
0.5695958010526547,And who the fuck decides which language is profane?
0.5265193427510236,Hey your morons like Sarah Palin so you\\\\'ll totally love me! I\\\\'ll outcra y the rest of the cra y bastards all the way to the White House!
0.6165804581331805,You have got to be fucking kidding me! LMFAO! You have got to be the most naive fan or you are just a troll.
0.7716669469328704,How right you are
0.5488879344021486,whatever. you are owned so you handle it Coco.
0.8361832233726325,Your site sucks. No big booty bitches videos.
0.5528174227957989,He better not fuck this up.  It could be a modern day classic.
0.6759645999799042,its a fucking trial!!!!!!!!!! limit of 1min!!!!!!!!!!!!!!!
0.5068431652699023,fuck yeah! i wonder about his new hair..huhuhu
0.5645867290473894,You are right. Do what you can while you can and hope to get to OCT and play your best ball. Like STL did.
0.5371199302438616,kikwang isnt in the mv..or are you talking about something else?
0.8301441276079032,And those of us fortunate enough to know you silver....are eternally grateful for your mom instilling and passing on her strength fortitude and endurance to you my good friend.
0.6097578460479972,I would say the same to you but from reading your posts it is it has easy to assume your gay
0.6270977689447593,Are you...a girl?
0.5726075505937425,It is it has Tupac motherfucker. The Illuminati did not kill me and I am alive and well.
0.6342042438182267,I think he left from embarrassment though.
0.5396406300730399,Obama killed bin Laden.   Who do you want him to kill? Or why not just do it yourself?
0.5973015830778654,World without heterosexuality = A world without people World without homosexuality = A world without AIDS and gay pedophilia
0.5640730978283026,Aita a  change your name to aitar . Shame on you Allah gave you respect and you could not keep it. Shame on you
0.5007303320376144,Wow you sound like me.  The first day back after my surgery I worked 10 hours.  We give overachieving a bad name I guess.  Take care of yourself OK?  And as for your therapist   fuck her.
0.945659267059501,More like fucking goddess.
0.5306251576247624,no.  You are beautiful! :
0.6953936196384642,So Sorry  for your loss. God bless you and your family.
0.6132766282949381,If you want to know if your school is fucked see if it is it has on this list:
0.537111911630238,How do you know she is not heart broken?
0.5106420438976633,Oh dear oh dear oh dear.  Did someone forget that bullshitting is frowned upon around here?
0.5148455087674652,That is a nice act of kindness.  You must be a good tenant for your landlady to like you enough to give you this.
0.5099127787264078,If you do not see the problem  then you are part of it.
0.5104775488527535,Hoping you are wrong about Gordon they could not kill the Comish!!!  :
0.5735470062930018,hope you are using a soft brush otherwise you may be doing harm to your enamel.
0.5602723917083738,@we r all husseins They are not the engineers. They are the whores of the greedy bastard engineers.
0.5353252562984799,No just people like you.
0.5930780853088609,You get a like for that one.  Thanks for showing some class.
0.6116380569349426,You are going hog wild pinning...  :   thank you.
0.6175285765279628,Ben Rose is a hot little fucker in every way.
0.535160255209772,That really sucks you cannot enter is your not a north armerican scum fuck the terms and conditions I am entering any way even if I have no chance of winning.
0.5933696713854174,Who is preventing you from praying?
0.5364785588662859,^TRUTH \ \ niggas still going platinum so I dont want to hear bootlegging killed your album. You album didnt sell cause its wack.
0.5178943474502222,That is so cute you are whereing that as your senior outfit
0.6069097463872228,idk just thought you were. lol
0.5391250473861467,Remember when you support Hollywood actors you are funding Obama and his thugs. Boycott their movies and cancel your movie package on your cable.
0.8331910886164532,Are you putana?
0.5512510895254423,Im going to period blood all over your dick
0.6182373761036433,You are just not happy are you? Lol
0.5796458725002326,Do you eat dogs? Have you seen a psychiatrist? Is DykesOnBykes.org down? Try nambla.org you have got mail there.
0.6182208794610108,shove it.  you are not even a parent are you?
0.5947729100193316,What kind of shitty name for a sword is Heart Eater?
0.5077541600996666,who wants me to fuck them so hard that cum will cum out of there face
0.5261379640164463,Why are you so hung up on skin color jm?
0.6205294997339198,You are correct.!
0.68519992944076,He had the shits lol.  Wtf
0.55678518944682,you know you are politicle farce when you hire Donald Trump for a lift in the red neck polls ...
0.5991245531154452,YOU ARE RIGHT. TRADE STUBBS NOW
0.6128425221899371,heey iedereen is fuck doei
0.7790274965896639,Samba for Bassong???
0.5757117241614315,get the fuck to iowa u fucks!!!! ofwgkta is worldwide!! wtf
0.6450519090785695,Welcome home thank you for your service now enjoy your family!!!
0.5072953115653817,Just gonna point this out to everyone talking about it even if Chihiro had sex with Rea she is he has a FUCKING  OMBIE.  I might get a blowjob though.
0.5022406342475841,When you shit does it come out cellophane wrapped ?
0.6440176536824203,You are forgetting DOCTOR WHO THEME
0.6102341617304938,Julie You are making me hungry.
0.8130490458165863,How do you do?
0.5816237181845406,YYYYYEEEEESSSSS    !!!!!!!!!!!!!!!   iggles gets a title match! FUCK YEAH!
0.5283231276166674,Uh  No it does not Adam.  Talk about speaking out of you ass.
0.5199344927904401,You literally always bring up children when you make fun of the Giudices. Are you a victim of abuse or something? Do you just hate children? It is it has actually creepy how you react to someone's children wearing some fucking sequins and being loud.
0.5752016599911497,Eff you. That rock alien was fucking hilarious.   Test one: Who can drink the most sulphur?    Test inconclusive.
0.5075746290840744,standards are higher when you call someone an idiot
0.629538255943057,your mother must be so proud of you.
0.6092720960179778,Bitch betta have my honey!!
0.6439446294134438,You are a genius
0.5457498533321321,Maybe you are argentinean prepotent like him.
0.7430703159377188,God bless your grandpa!
0.6112969394340574,Good luck to you :
0.6215623732567124,Curtis you are killing me man
0.5529357125955213,GOODNIGHT DEB.  JUST LEAVING.  GOD BLESS.
0.6678405629707888,This niggas gay....she got a cute face and big tits....you should ALREADY be hard......bring her over here....
0.527660683904722,Be careful what you steal.
0.5038079428752854,cemeteries freak me the fuck out! the end!
0.574447861251247,If you have any of the other you are all.
0.5166121004730114,and it get's better. coming back to the page the fucking Autoplay is ON AGAIN!!!!!!!!!!!!!!!!!!!!!!!!!!!!!!!!!!!!!!!!!!!!!!!!!!!!!!!!!!!!!!!!!!!!!!!!!!
0.9717046677725174,fucker israel
0.5299969986349864,Fucking sick car. It'd be tight as to live in though and gas would be a problem :
0.515689473049909,1 close your eyes2 think about how much money you want3 post this on 5 other games and look under your pillow
0.5733220948000248,african mothafuckas looking like they wanna kill this nigga lol he just having fun. A nigga can get killed for the dumbest shit in africa smh
0.586138618818764,Snookie   your wife GO AWAY
0.8370292352448265,you are HOT!!!   Damn!
0.6958074483779485,you sir are spot on.
0.6484439800291604,Your comment shows how poorly informed you are.
0.6627213014689106,Love your layout and the way you used the dies.
0.5383128641233267,The fuck is the control room doing?
0.5105128091305823,Your butt is still hurt for the 2011 NFC Championship Game?
0.7967263805508258,Joe Rogan is one naive mother fucker
0.6205294997339198,Happy you shared!
0.6131750334527573,ChrisMontana Tell me how I found out Jamel was the bitch ass who took your beer lmfao
0.7016838209516328,Vai ser bonito assim na puta que pariu huahua Fucking ama ing design.
