0.5601996813173662,hope you are using a soft brush otherwise you may be doing harm to your enamel.
0.7323456153885786,@we r all husseins They are not the engineers. They are the whores of the greedy bastard engineers.
0.5418680227178106,The sexual preference of your parents does not determine your sexual preference.\ \  Every gay person I know had straight parents. Every child of gay parents I know is straight
0.5193502260161357,No just people like you.
0.6365574675736787,I spilled details about her riding my dick?  And what I said is my woman would not let him sniff her panties when he said he wanted to fuck.
0.5812145524817214,That is one fine ass hairy black man! I could eat HIS ass all damn day! His bod needs a tongue bath desperately!!
0.6185991735002553,You get a like for that one.  Thanks for showing some class.
0.5879107018591649,You are going hog wild pinning...  :   thank you.
0.6236493786175291,Ben Rose is a hot little fucker in every way.
0.7566696565966233,That really sucks you cannot enter is your not a north armerican scum fuck the terms and conditions I am entering any way even if I have no chance of winning.
0.5382401111638482,Who is preventing you from praying?
0.6579361694277789,^TRUTH \ \ niggas still going platinum so I dont want to hear bootlegging killed your album. You album didnt sell cause its wack.
0.6185227927112537,It is it has not like all straights have an issue with homosexuality.\ \ \ \ The issue appears to be that some people of some faiths somehow think it is contagious or are afraid of the temptation or something.\ \ \ \ The issue here is appeasing the evangelicals and the biggest issue is that the people who seem to care the most are the least likely to actually run into many gay people to start with. \ \ \
0.5884105587099379,BABASTARS   OTR i say fuck em kejt ?  homie kta kta jon kejt pussy paguj lek si me hupci me stupci vjen musafir reper mir t presum vjen reper gangster t vnojm n shenjester homie is NEW YORK city sun um gjen dot hall on filli.
0.5534239145863337,idk just thought you were. lol
0.5638977990193357,Remember when you support Hollywood actors you are funding Obama and his thugs. Boycott their movies and cancel your movie package on your cable.
0.7269129724519734,Are you putana?
0.5230267174416777,Im going to period blood all over your dick
0.596216330538569,You are just not happy are you? Lol
0.6457252499293454,Do you eat dogs? Have you seen a psychiatrist? Is DykesOnBykes.org down? Try nambla.org you have got mail there.
0.6000076720219445,shove it.  you are not even a parent are you?
0.6218646514731981,What kind of shitty name for a sword is Heart Eater?
0.7453704677182181,lol boichi really makes you wonder does not he? how much time is spent proofing inking finali ing? i want to know hell i want to intern god dammit how the fuck do i get on board!!  come on kube let us go to japan!
0.5901404947686709,This Guess the Clown game was STOOPIDER than Bri's BigStoopidO 5 contest!  Whoo ewiffme??????????     I have got a guess:  who gives a fuck!
0.5394778311316066,Nobody said they could take away your honours or accomplishments so stop tying to sour others!  So shut up and take a loss fergie.
0.5994116186289737,who wants me to fuck them so hard that cum will cum out of there face
0.5031457129678631,Why are you so hung up on skin color jm?
0.5315047127014785,Go vote for him then nobody else is he broke this country. Anyway wasnt talking about you just the person that likes child molesters.
0.6191279823955925,You are correct.!
0.6771428409255369,I do not think Duh U can reasonably expect any NC's anytime soon. Your biggest recruiting inducement  blow and hookers  has been removed and now your former AD/COI member has just passed away. If you sucked while all of those resources were flowing into the program then imagine what its going to be like without it.
0.5617314352989927,He had the shits lol.  Wtf
0.5836414090457193,you know you are politicle farce when you hire Donald Trump for a lift in the red neck polls ...
0.5639184113465151,YOU ARE RIGHT. TRADE STUBBS NOW
0.6129315751582607,get the fuck to iowa u fucks!!!! ofwgkta is worldwide!! wtf
0.6332691754160252,Welcome home thank you for your service now enjoy your family!!!
0.7746101609312048,Just gonna point this out to everyone talking about it even if Chihiro had sex with Rea she is he has a FUCKING  OMBIE.  I might get a blowjob though.
0.5831037929842234,You are forgetting DOCTOR WHO THEME
0.5554422363871216,Julie You are making me hungry.
0.7433568750674779,How do you do?
0.5717805789976625,YYYYYEEEEESSSSS    !!!!!!!!!!!!!!!   iggles gets a title match! FUCK YEAH!
0.5370420545623189,Uh  No it does not Adam.  Talk about speaking out of you ass.
0.744191917356718,You literally always bring up children when you make fun of the Giudices. Are you a victim of abuse or something? Do you just hate children? It is it has actually creepy how you react to someone's children wearing some fucking sequins and being loud.
0.7107666259349571,Eff you. That rock alien was fucking hilarious.   Test one: Who can drink the most sulphur?    Test inconclusive.
0.6078786285537341,your mother must be so proud of you.
0.5012767648477063,pu uc ck the \ \ democrat TEETBAGGIN ...union scummies......50% don\\'t pay taxes that the country needs to operate...and they suck the life out of gov ment programs...and all Odumbo can say is.....it\\'s the richs fault.. No it\\'s the fault of people who drop out of school have a bunch of kids...and watch TV...play on the internet...and xbox...and soak up the Food stamps Medicaid free school lunches free baby siting...WIC EIC Pell grants to go to college and study... medical asst dental asst...and other  show up and draw a check...\  \ GO VOTE and take your friends..Que?
0.6352088082348861,You are a genius
0.5022042100817868,Maybe you are argentinean prepotent like him.
0.6569470706626199,God bless your grandpa!
0.5981884059508502,Good luck to you :
0.568331693845306,Curtis you are killing me man
0.8292617795220875,This niggas gay....she got a cute face and big tits....you should ALREADY be hard......bring her over here....
0.7180583048018148,Again I do not give a shiite.  Get rid of all these motherphucking parasite bloodsucking worthless administrators and let the teachers do their jobs.  Teachers are teachers because they want to teach empower and inspire students.  Administrators are administrators because they want to acquire money and power for nothing.
0.5114338742971377,Be careful what you steal.
0.5446452644326656,If you have any of the other you are all.
0.6704772728702141,and it get's better. coming back to the page the fucking Autoplay is ON AGAIN!!!!!!!!!!!!!!!!!!!!!!!!!!!!!!!!!!!!!!!!!!!!!!!!!!!!!!!!!!!!!!!!!!!!!!!!!!
0.5668406593034825,fucker israel
0.6588548201314466,I hope not. I hope that a giant meteorite hits the earth before anybody is elected and we are all destroyed. Both candidates SUCK.BALLS....
0.6707924770317666,Fucking sick car. It'd be tight as to live in though and gas would be a problem :
0.5000292498966482,im feelin a lot of haterade in here and it seems to be a comin from the females of the room! ladies! Question? if Playboy came up to you and said wow you are ama in and we want to shoot you!! everyone hating in here would jump out of your skin to accept! ! you know you would! is Marston a POS! YES!! is Chris Brown a POS! YES! BAN EM! Im a playboy subscriber but lately my faith has been shaken! waht do expect from hef hes has elaphantitis in both hands! look! he is dying of Hep C! did you know! Why do you think Crystal Harris dumped his ass!! dead man walking.
0.6303622816283464,I like it when people say COD is notorious for Michael Bay crap. I do not understand that. Its fucking war. Guns flying everywhere and bombs dropping is what war is about.
0.8692635770272543,african mothafuckas looking like they wanna kill this nigga lol he just having fun. A nigga can get killed for the dumbest shit in africa smh
0.5074161392281291,so if you water your lawn at the wrong time of day the police will find you and issue a ticket with fine. shoot your gun off any time of day in Chicago injure or kill someone those same police may or may not find you???   Something wrong with this picture
0.5646160922537693,Snookie   your wife GO AWAY
0.7098785231971537,you are HOT!!!   Damn!
0.6312592105079783,you sir are spot on.
0.5964678629234508,..........I fail to see how 2NE1 are any more western than 7 sexy as hell girls in corsets.
0.6191829596843801,Your comment shows how poorly informed you are.
0.5667439386660675,They want it to go to E15  aka 15 % corn.crap.  That seriously damaged 2 out of 8 test vehicles made before 2001 in an independent study.  ASSH0LES!
0.6370445835205234,Love your layout and the way you used the dies.
0.7059803998104027,Joe Rogan is one naive mother fucker
0.6191279823955925,Happy you shared!
0.7356160022939254,ChrisMontana Tell me how I found out Jamel was the bitch ass who took your beer lmfao
0.807189993524203,Vai ser bonito assim na puta que pariu huahua Fucking ama ing design.
0.5071096529775801,I do not think they actually knew it was a girl. I do not even think they know he has a  team  or whatever the fuck you want to call it.
0.5049474795600712,I\\'m sure Rick Santorum is an honorable man   and he seems to have true convictions  unlike  do I believe in anything  Mitt Romney . \ \ But he is big government man and opposes abortion even in the case of rape  which cuts against the grain for many independents . \ \ If the Republicans go with a social conservative who is okay with big government they will get creamed in November. \ \ Of course if Santorum now starts talking about controlling spending and reining in the si e of government then Obeyme would have reason to wake up at night and worry about what he and Moochelle will be doing come January next year.
0.6256927300413944,Gears of War: Judgement will be ama ing for sure! I was very depressed after 3 ended thinking to myself  ITS OVER NOOOOOOOOOOOOO.  Then I watched E3 2012 and saw Judgement will be coming out and said  HOLY FUCKING SHIT HONEY GRAB THE KIDS WE ARE GOING TO PRE ORDER THIS SHIT!!!  Course we do not have kids...just our xboxes and our cats......BUT WOO JUDGEMENT!
0.5012691030905181,LOL...Why are you wasting your time reading the comments?
0.6817596571599335,All Yall Bitches On Here Sayin She Deserved That Yall Dumb Is Hell Yall Must Like Getting Hit By Niggas
0.5187063373713101,With this attitude you must be liked veru much by your little students :
0.7303811072259552,I LOVED HIS CLEAN CUT DICK HOPED I AM THERE TO SUCK IT AND LICK AND ALLOW HIM TO FUCK ME...
0.5215941083029236,caca  is a nicer way of saying  shit  in Romanian. Like  poop  I guess. Just sayin
0.6632412582704961,It is it has his fucking fault for not understanding that is that has who he was fucking dealing with.
0.6284372169161433,KD COME THE FUCK ON YOU HAVE THAT JORDAN'S BLOOD COME ON
0.5723489912609581,YES you are awitin.
0.5451578570582478,sexyred .....  you are right ....  time to move on .....
0.6400049833056545,This is a good shirt to wear if you want the shit kicked out of you while bleeding from every orifice and sporting an atomic wedgie.
0.531035710127984,Prison internet does not have an outside lineis purely for computer learning classes.
0.6632266506034422,Nobody gives a damn what you want crybaby.
0.543328399139019,Yeah right. I am an idiot. Meanwhile you believe that a conspiracy started 51 yrs ago because a time traveler decided to plant 2 birth announcements in the Hawaii to cover for Obama once he became president. And you also believe that the CIA Dept. of Justice the FBI and every other government agency is in on your moronic conspiracy theory.  Plus you believe what you read on this website.  Who is who has the idiot?
0.5501629799223754,damn i had to watch this shit again.......3 weeks LATER
0.508726557678419,oh and one more thing i rather stay at home and put a porn dvd in and jack off and go to sleep be for i go out to rape some innocent lady that has done nothing to me real talk hands down???
0.6706555217380527,morons like you do
0.5857932383665873,Hi Nana...How are you today?
0.5000876230540662,Did he know someone who was a boy molester you will all throw trash on him next
0.6827410907705836,pedophilia is no more rampant in gays than it is in heteros do some research so you dont sound so much like a bigoted douche
0.5114894970309628,Fuck flying cars fusion energy and world peace: Give me a device to choke people out over the internet.
0.5348435321936182,FUCK OF BLANKY FACE THIS WORLD IS GOING UP IN FLAMES!!!!!!
0.6690725340376436,i know alot of android and apple fans are a little upset right nowbut its normal to act this way when your shit just became obsolete. its ok me and the other billion people who use and will buy these products will still welcome you with open arms when you finally get over the money you have wasted on shitty products.
0.6145026092790477,@gregadeaux  that guy deserves a fucking medal.
0.6305830759908955,@Hobbes83 Blow it out your arse who died and made YOU boss?
0.5500332689722927,who is who has this ugly bitch?
0.5986264794280233,junkiealcoholic who could sing a bit.failed father now seeking as much publicity as possible.anyone else and this story wouldnt make local news never mind national news.couldnt care less.before all this crap came aboutno one wud know this mitch from adam.go away and spend your cash made off your daughters passing away.
0.7127583265051883,I do not think you should be silences. I think your comments should be seen by the FBI. I can bet a lot that you engage in terrorist activities melanie77. You have the intelligence and ethics of Mohammed Atta which is why you like those murder Americans and Jews. Your potential for mass murder is exceptional melanie77.
0.5542065691277206,: O. r u fuckin kidding me?
0.5639574395224939,Your  hunch  is probably correct....
0.5844856615065747,We are watching you as you watch us!
0.5844312498842915,what a nerd. you would get your ass kicked by a black guy if you used that word in front of him.
0.5148691234990146,I will i shall be watching you... from your closet
0.5221773193003025,bullchit  using a scat phrase in your chittyhonor  Obama and his handlers namely Axelrod have incorporated bin llladen as a mythological enhancement to your communist hero's fading image. Your are not only 'full of it' unhinged and repulsive you are a LIAR.
0.5301350627014815,Jamey you aint kidding!
0.5473020190181219,and yes in Pakistan you cannot call people its against the law... especially if they are mad at you. You can only use the telephone to talk to people with whom you have no quarrels or issues with.
0.5325947555892223,I remember taking a speech class in college and the instructor demonstrated why you need to have your speech in a binder by showing a video tape  yes a tape Reagan was still in office  of Reagan giving a speech on an airport tarmac.  Ron started out reading his INDEX CARDS and doing just fine then a big gust of wind blows all the cards out of his hands.  Reagan stands there says  um uh um uh  several times and is unable to continue.\\\ \\\  \\\ \\\ How I wish THAT was on YouTube.
0.5080115056722246,Ah you go to a game to watch it not have some moron spill beer on you. If he do not like it stay home you say. If some drunk moron can hold his beer maybe he should stay home instead of soaking others with it. The idiots can blow the horn into the air why into a guys ear.
0.6920921652308898,You do not play competitive sports do you?
0.7502279965139267,Well you\\'re right. It\\'s no longer about the music  fresh harmonies interesting rhythms ORIGINAL melodies clever thoughful words. Nowadays it\\'s about gyrating grabbing your junk showing your panties threatening to blow somebody\\'s face off or doing something absolutely stupid to grab attention. The  music  such as it is is secondary.
0.5257584090805418,Obama has a Jeckle and Hyde personality. He abused drugs at an early age   intense drug abuse   pot and  blow   cocaine . Heavy drug use in one\\'s past can contribute to manic depressive moods and have a permanent impact on personality thereby creating an unstable individual. Obama\\'s highs and lows are not attributes that contribute to the stability of the presidential office!
0.5613459603482582,I wish Santorum was as feisty as Newt when Gregory asked him about Mothers being ban from his staff. That would have been a hilight. Gregory what a puke.
0.8410878165057598,Hell yeagh man kluv these hot pig fukkas luv to get over and do the same wiht you man You sound fuckin hot!
0.6211250134137972,video's the SHIT...who you think you are Albert Einstein ....LOVE IT
0.7640873764702533,YES. OH MY FUCKING GOD.  THEY'RE BACK.  THEY'RE FUCKING BACK.  Excuse me while I go drown in my pool of tears.
0.7613725841207738,nobody has arrested george w bush or dick cheney for the murders of over 3000 people on 9 / 11 ... why should we expect a quicker result with assad ... ?
