0.5564740579239458,@Rourke needs to give me a fucking like I feel the republicans have been over lobbied by doctors to ever support a free market solution to the problem
0.645458935400576,Who are  the Muslims ? I did not know a whole region was represented by a few people. If you have not noticed Libya is naming street and squares after Western leaders who backed them when Qaddafi was murdering them.   Get a clue. You are repeating stale old lines that have no relevance and you are making excuses to let the massacre continue.
0.5143444384398786,You do what you gotta do to win and make money
0.60854661614334,@jsdavis13 Making all care for the least among us  voluntary  is a great way to put all the burden on the good guys while leaving the greedy bastards with plenty of money to destroy the good guys.\ \  \ \ The only people that object to being required to do good are the ones who would not do good otherwise.
0.5516435005972625,you are a funny girl!
0.5388143830493445,Can we please start with the head of the  cl ass?
0.5705472918033117,ROFL!!!  You libscum cannot even WHISPER  bush  anymore without causing rolling laughter......how pathetic you are and always have been. SO over....play taps....
0.8447191761421073,Do not be a fucking asshole do not strike up awkward conversations with strangers on the subway
0.5046312464884259,@SlimShady     yeah you are so number 1 in terms of stupidity! who cares when you are the first one to post! :
0.5546795412197091,by laptop are you referring to the position you have the children assume white Sandusky?
0.5505146942106205,Good job..like your style!
0.5288847883961778,F  u Ron Paul sell out schill bastard. Rand you are no dif than any sob on the hill! Romney.. BURN in HELL! Id sooner vote for Satan
0.8513233296667652,There is totally nothing wrong with having a fetish for black girls. I am a black guy who has spent most of my life fucking white girls.....those gorgeous pink nipples do it for me! Do not think so much dude...to deny your sexual self would be to deny yourself completely.
0.7657094202194179,There was dancing in the street after 9/11!!    AND WE  THE US  CONTINUE TO GIVE THESE MOTHER FUCKERS MILLIONS  OF DOLLARS AND GUNS!!
0.5450142245569816,'I play a lot of games where I just get into the flow of combat and it is it has  getting good then boom cutscene. I am like 'Fuck you get back to the  gameplay.'   Cliff B   Max Payne 3 anybody?
0.5644961083114121,Oooh I want that soo bad!  I want to be your fuck toy!
0.613365006194498,\ \ My 18 year old son says she sucks ass.
0.5120578287520533,You get used to it after a while. You have too.
0.7266794808990189,THAT is one BI ARRE opinion that Roberts fuckingup the Presidential Oath of Office resulted in a Totalitarianism over the USA. LOL have another drink pal.
0.6261072457656982,In a country with little to no building codes and ample disposable manpower  would I step foot in that catastrophe waiting to happen?\r Oh.  \r Hell. \r Fucking.  \r No.  \r Way.
0.8007753783709762,Man im gna get one of those . And his fucking was hot as shitt     3
0.7068340031680905,Right? That is that has always bugged the shit out of me in that dumbass series. That and the fact that they assume that if a human sees a sparkly fuck out in the woods they will they shall immediately assume they are a vampire. It is it has just too damn ridiculous.
0.6311272214625457,real talk u already snow these niggas be cryin we on real nigga time and we fucks wit all da battles not just big names.....snow dat boy  in da buildin
0.8721062785904704,To ti je Crveni  61korpion ovaj je pripadao Hugu Prattu a se inspirisao gledaju 07i uvodne scene Peckinpahovog filma  Divlja horda . U 0deni ljudi ka 7eu  61korpija najbplje simboli uje ljudsku prirodu. Mo 7eda si  0duo onu pri 0du kad  7eaba nosi  61korpiju  koja ne mo 7ee da pliva  preko reke. Na pola puta  61korpija ubode  7eabu koja je  aprepa 61 07eno upita:  Ali  a 61to to radi 61 sad  07emo se obe utopit?   60korpija joj ladno odgovori:  nam ali niko ne mo 7ee protiv svoje prirode:   60korpija je kick ass hardcore motherfucker ka !
0.6549393381182672,Did you force yourself to be straight? If you did you probably are gay.
0.6278230299556053,Fuckkk you dodgers!!! score some frickin runs for fucksake
0.5569876979550141,right.....if republicans were in power NOBODY will be poor.   LMAO
0.5311047125637669,BIG BANG !  3   sorry Katy... i love your music but    LOL fuck it i dont even like your music and never did :D
0.6118157098249871,You hear more comments about the Heat on this forum than you do OKC...LMAO shows who people really fear!
0.5493358031414796,hope u and yours are safe tonite Bill
0.6950013532106456,Them ? You mean the extremist group that enslaved the rest of the population and that mostly originally came from PAKISTAN rather than Afghanistan itself? Are you really so short sighted evil and stupid that you would want an evil  authoritarian group like the Taliban rule simply because you do not like America?
0.5013971692279338,For everyone's sake lets hope you are wrong.
0.6406811213716718,Nobody's forcing you to work for Catholics are they?\ \  Be responsible for yourself and do not get a job there.\ \  If you decide to work there go to the dang health department and get\ \ cheap birth control.\ \  I am a woman you are a woman suck it up and put your big girl panties on!\ \  Take care of yourself!\ \  Nobody is required to provide anything for you....they are called BENEFITS not requirements!
0.6047608785841113,Oh dont be so hard on yourself freddie...youre a smart person...and gosh darn it people like you.
0.5285038325123012,Yes because you and your ilk make it like this.
0.5494096029344032,Ah for fucksake i cannot stand her voice
0.5676043614641643,I am so fucked.
0.7530981546754747,LET HIM FUCKING SHOOT THE BALL!!!! WHY ARE WE CLOSING ON JAMES?
0.5060908585164666,Fuck naman yon :O I do not really like lowriders gee  kung meron lang stock nung G.I. baka yun na talaga binili ko. Maya maya ako kinakabahan baka mabali wtf  :   And yes haha it is it has okay I know how it feels =
0.5740163924243286,Get the government out of our lives yells the republicans.\ \  But it is it has ok if you pass a law that bans gay marriage even though it does not effect me.
0.6916114749761245,With all due respect you are an idiot. Conservative Liberal either one would raise unholy Hell if their daughter was being assaulted.
0.6514299563999494,Oh girl you got dem shoes..
0.5106392678073287,dmallett you are making an assumption that the people heckling them were liberals but you have nothing to back that up other then your biased belief.
0.5945399550612627,@Rourke needs to give me a fucking like nope not a fan of cajun food.
0.5700715888762392,More like faggot.
0.7088164143214888,Big Bang Theory and How I Shagged Your Mother are both terrible TV shows.  Watching either of these things makes me feel I need to loose a hundred IQ points to get the lame jokes. Fuck American comedies suck.
0.5911100505200798,Guy at a party\\\\\\'s been looking at your wife.  You  and several other guests  hear him say of politicians in Washington  Those bastards should all be taken out and shot.   Next day you drop a dime to Homeland Security    and the guy never sees your wife again.  Or his.  \\\ \\\  \\\ \\\ Wouldn\\\\\\'t be the first time in history...
0.5963452359802631,Our deepest sympathy to you and your family Katrina. May you find the strength you need in your children xx
0.8205613858442212,Sasuke thoughts   You burnt my fucking snake now you die.
0.5529232626685611,Arrest all of these scumbags for fraud.
0.8977622303149541,You can take your mom here when you get rich!
0.5421279108035854,Where are you in Syria?
0.6323169705759396,Your article headlines suck you are a horrible journalist that barely even have any grasp on the english language.\ F that you are not even a journalist you make headlines for dirt sheet tabloids.\ \ \ F this site and your opinions I want news not an article that starts with you begging people to follow your lame ass twitter account.\ \  Go and hop on some more band wagons you hack.\ PEACE never again coming here.\ \  This is just too much crap from you.\ \  the final straw.\ \  PEACE.\ Any suggestions on which site we should all jump ship to?
0.5708832852703913,Sounds like your mother.
0.546497213803279,WHY THE FUCK DON'T YOU HAVE LET IT BE!!!! Other then that love Blur Elton RHCP Floyd Led  ed Eagles Aerosmith Stones Lennon and Coldplay. But you miss some really good bands.
0.5358328987090996,@kj1222 @PatrickLacroix i have no clue i tryed this and it didnt work now i am going to remove the crt and then remove the ass.plist and then reinstall crt and try again
0.6752039780221193,Hey Burd 52.... Your picture is black and white! And you have glasses on!
0.6261794592477911,so your a liar then
0.6207125180166609,HOLY HOT DAMN you already raised $76000??? shit haha that is impressive... what a bunch of toolbags at funnyjunk with an idiot lawyer..
0.6777762902075317,@Rourke needs to give me a fucking like  @aciddragon    Mmmmmm...Babcock!   Heheh. Cock.
0.6593976271672677,@Rourke needs to give me a fucking like  @Preparation A Does wayne brady need to slap a bitch?
0.6352088082348861,You are right on
0.6071646641244028,If you dont respect your body why would you respect anything else ?
0.5494851030951486,I have a sticker you can put on your laptop.
0.6702187918937629,Sly appears to have some good ass... Especially in the rawrod scene... where dude fucks that ass royally...
0.7312994056718897,Lesbians are as a percentage of the population half the gay community. And yet their transmission rate is six time lower than it is for heterosexuals. Does that mean that they ought to be able to consider heterosexuals to be filthy disease spreading monsters?
0.6987004658997488,I am so fucking sick of seeing  this guy should be Christian Grey!!!!!!  everywhere. 50 shades is the worst book I have ever read. horrible writing the sex wasn't even hot. ugh.
0.5060118860652238,But you are not rich and you do not understand how any of this works.
0.6079036693411897,Oh God arise May your enemies be scattered.
0.6422634341708733,I hope some of you reali e YOU are the reason young gays  and all ages!  commit suicide.   I hope you can sleep at night   the blood is on your hands.
0.5657394955702697,Abso fuckin lute ly.
0.8074492058104412,Tell you what.  I can paint that car up something fierce.  I am thinking an angel on the hood but like you know a naked angel with big tits out and all that.  A snake wraps around her but the snake is not a  snake  it is it has a dragon because dragons are cooler than snakes.  Plus I cannot really draw snakes all that well especially with magic marker on the hood of a car.  Anyway there is there has gonna be clouds and shit and maybe a rainbow but a fucking KICK ASS rainbow.  Not like some of those dumb rainbows with unicorns and shit.  Fuck that.  Maybe some mountains and shit like that Bob Ross style.  That fucking dude could have made a fortune painting stuff on kick ass cars.  Anyway let me know if you want me to drop by and paint and stuff.       You have an El Cameo right?  Cu  that is that has all I work on.
0.5291471286035715,You can blame us for your shortcomings all you want but it will not change anything. Why not go talk to your friend and start making amends as early as now?
0.5758688082399332,My question is:  Who the fuck still buys Ivory?  I mean nevermind the fact that it is it has gaudy as a decoration and very socially unacceptable but it is it has also functionally useless  as far as I know.   Who buys this shit?  Am I missing something?
0.6548602150187567,You do not say?
0.6904329213467376,I like  immer especially of late. His work with Nolan and the stuff on Sherlock has been awesome.  That said I do not feel like he has the sense of lightness and fun which my ideal Superman requires.  Unless they are going for an all out explosive Wham Bam kind of film you need a lot of heart and a light touch.  For my money Christopher Doyle  his work on the last Harry Potter was great  or Michael Giacchino would have been far more preferable to  immer.   Still I will i shall wait and see and I will i shall only be too happy is  immer actually pulls something off. He must be shitting himself though. No matter how good you are as a film composer John Williams is a fucking tough act to follow
0.6566360241034714,PED's destroy your body.
0.5041193934296377,You are correct about the black hole thing.
0.5568369196635509,@Kewldood69 i really wish I had been watching them all season but I cannot fucking find them on DirecTV. I had i would feel cheap acting all excited now.
0.6628299417051203,Call the vote. Slap this bastard down in front of  his people.  Let this pimp/murderer/punk/liar peddle his toilet papers in Hell.
0.7352560283125545,PRI E WINNER!!!!  DT  lets get immigration mentioned on the most inappropriate thread  competition.  Coming soon:  Homosexuals responsible for water shortage!
0.8047086369057851,''fans'' do not hate you mean haters do not you SJDFSOHGIDUJGBFUCKINGSTUPID?  and what I am living proof that we do not.
0.5013126406151862,What is fox coming too when they reject your post telling how vile and stupid democrats are.
0.5389788512967927,Like your pictures.  Follow?
0.6194039068995973,I just finished Doom 3 today :P Fucking torch with no gun!
0.5139709855893093,Cat can only catch your tongue when you are advocating what is unwholesome.
0.6199066822726489,I like your comment.
0.585043018305095,@Rourke needs to give me a fucking like  @aciddragon But he is rich.   Can buy many thermos.
0.5121890374136279,Well yeah that is that has very sexy indeed... Ivy I want more of your sexy side.
0.6012776865180824,crawled out of your hole after 44 years have you?
0.5812398754301514,The father stopped the sexual assault the moment he dragged the assailant away from his daughter. What followed was rage fuelled revenge.
0.5292288043892851,You are abusing your power whatever that might be Hyden. You just got it by writing really interesting balanced essays. Now you are trying to push an accomplished life long depressive off the cliff that he hovers over.  What the fuck are you thinking?
0.570029876298054,I am not 100 percent positive they will be playing in October but I would not bet against the Phils.  After all they have won 5 straight division titles.  They also could have Howard Utley and Halladay back by mid July.  Those activations are the equivalent to trade deadline moves.
0.5535675663007674,I am against fraction mentality. I am also a Rubinius adict Open source devotee and if you use Emacs you will fuck up your wrists before I do and then I will take over your jobs.  It sounds consistent.
0.7853990291537633,@Rourke needs to give me a fucking like  @LambeauOrWrigley  @aciddragon    Reesy's thermos dented?  Reminds me of a killer line from  Horrible Bosses .... Jennifer Anniston's horny dentist character reports watching some beefcake guy on TV and  ... fingering herself so hard  she  broke a nail.
0.519510518556331,Hi ASHLEY. How many screennames do you have?
0.706104918905853,Listen motherfucker! We only sing 80s Joel!
0.5354930020702521,\ \ The only thing anyone's complaining about is a 501 c 3 non profit acting like a PAC which is not legal.\ \  \ \ Get your head out of your ass idiot.
0.5278532263184621,lol no allkpop decided to use a pic of Tiffany with fucked up dimensions.
0.5618791311845079,If you do not like yourself why would you expect other people to like you?
0.8285095476008835,Retarded fucking Tide helm.
0.6922069722034693,Ditto.   Two thoughts though: Mitt Romney's Religion should not be discussed and the rich in Greece are not paying their taxes are two fucking lies that should be called immediately and loudly. Even screaming if it will help.   The Republicans  say  love their religion. They want everyone to love their religion as well. They accuse Barack of being a Muslim and follower of Mohammed even though he attends Christian Churches and sounds like he is promoting Christian Religion a lot of the time  AND.   Jesus Christ! The rich and the corporations DO NOT PAY income taxes here. What right have these asses to critici e another country?
0.7415633261065956,Infinite thanks for not calling your vulva your vagina.
0.5247056881710627,What is what has confusing though is that when the KKK does something horrific you will not find thousands of Christians celebrating. When Muslims kill you can find whole cities celebrating.
0.7749103727474095,Fucking slow assed game
0.5224829202602237,How come you are sooooo bad? You do not win ANYTHING????? You must get paid by the books.......
0.5277351976614427,ooo damn you corrected it before I could get it finished.. darn :
0.6313331646115693,Det m  v re en fucking joke!
0.8659946837467133,SNAIL WIVES USE SMALL MOTHERFUCKING KNIVES ON PAUL SMITHES
0.6624975725642367,you should butt out sean you dont even live here
0.6145353221741233,He deliberately brought this to a PvP engagement....  My mind is fucking blown...
0.7669731936366408,dude do see CM Punk getting suspended anytime soon no.... hmmm why is that maybe its because hes FUCKING Straight Edge dumbass Randy Orton is not so Randy should not be the poster boy even though Cena is the poster boy no one wants him to be they want CM Punk Daniel Bryan and Dolph  iggler
0.5450824782632437,What the fuck is hippo? thanks to hell tourism!
0.6381036789601192,PPPPPHHHH.....\ actin like a dumb bitch about some nails she waited till all ofem done.... yellin bout 20 bucks and a ugly ass weave and or wig super thick makeup..... you think thats bad?\ thats horrible...
0.6379819800310601,det er fucking scary
0.6806917497807202,how many of you gay rights supporters would sign petitions to\ \ legali e adoption only incestuous relationships or consenting polygamous unions?\ \
0.9086722831712084,Wow!! You are so ignorant it is truly sad. You should move to a communist country because only in a backwards ass communist country would your extremist views be accepted. Voters dont matter? Cu  thats what you are saying right? Republikkkans like you are what is wrong with our country not gays and lesbians. At least they have a sense of humor you people are just downright retarded.
0.7663640166313456,FACT: 3 out of 4 pedophile acts are homosexual
0.5445786980913893,wow! you are a well travelled guy^^ did you like London? the weather here really sucks! ugh!
0.5008148754472593,And they cannot tell us how much money they fuck away because that would be.... telling on themselves. Another invasion of privacy.
0.5052943527138058,We are no different than they are if you define murder as killing innocent people
0.5532456881297636,wtf with your  TRUE NBA FANS  do not tell me what to think just because you are pigment challenged
0.5283743788504113,If you really think that cutting out a one heart here and there matches many repeated incidents of mass murder then you are merely seeking justification for continued mass murder.
0.5372061852405238,To ascend you must die.
0.7351418844603902,I hope their next tour comes through Dallas again they fucking blew my mind last time they were here.
0.5273829673501138,You will be in stripes before he is.
0.5749366913365428,Would not you just LOVE TO KILL HIM?    WHAT COLOR IS YOUR GUILLOTINE  ?!
0.5379442313929815,Come on Erin did you report the  harassment ? I sure hope so because it'll draw much needed attention to this disgusting pin.
0.713652418775614,And the whole universe is being slowly sucked into a black hole in space. see how it all works now? we are all fucked no matter how or what we do in life. life is rigged to work against us all. we cant win no matter what we do. we are all hand string puppets being slowly tortured our whole lives till we are dead by some force out there we can not control.
0.5704153315705579,Cut your damn finger nails woman.
0.60761828582508,You say Ben is a bad guy you expect nobody to check you out when you make a comment like that.  Seriously?  You are a stooge
0.7538980987782008,Shame on YOU.  Where were you when Perry was abusing her asshole.
0.6522244057560088,haha Ted Nugent? Are we talking about the same Ted Nugent that purposefully crapped himself to dodge the draft? Or the one who tried to legally adopt a minor for the sole purpose of having a sexual relationship with her? Sounds like a real red blooded bad ass.
0.5454920542082999,And who the fuck decides which language is profane?
0.624713734896464,wow you think the spelling is bad in here???   try reading one of those stupid ass libtarded web sites  ya now like the one backed by the NA I collaborator George Soro's MEDIA MATTERSnow there you will encounter some real dumb mother fu*#*#'s for sure.
0.5375638568682889,Lame ass nigga you just mad cu  u were raised by wolves i been thru way more than u ever will most of my friends are dead or in jail my belief in God gives me purpose you dont know why you wake up everyday lost little boy i pray God opens your eyes before its too late
0.7026897994903925,Hey your morons like Sarah Palin so you\\\\'ll totally love me! I\\\\'ll outcra y the rest of the cra y bastards all the way to the White House!
0.7695770586308532,You have got to be fucking kidding me! LMFAO! You have got to be the most naive fan or you are just a troll.
0.6907856263894243,How right you are
0.775930179307902,You are both having a laugh!  The iPhone 4 and the iPhone 4S have only one usability feature which really sets tham apart and that is Siri.  Also the time between the iPhone 4 and the 4S was about a year and a half and the update was as I said shit.     Also  Justin  did you really need to go all Foghorn Leghorn in your post?  I say did you really need to....  But to answer your question an update after 18 fucking months has to provide something worth updating to.   You wanker.
0.521152490364177,whatever. you are owned so you handle it Coco.
0.8006415231052553,Your site sucks. No big booty bitches videos.
0.6126852435782889,He better not fuck this up.  It could be a modern day classic.
0.6170029635860951,its a fucking trial!!!!!!!!!! limit of 1min!!!!!!!!!!!!!!!
0.5946336477784996,Another date that works for Conservative men is to dress like a Pimp and convince some young innocent girl to be your whore so that you can take down ACORN.  \\\ \\\ tip submitted by James O'Keefe ref.  Andrew Breitbart
0.686966057091452,I always do a search of Matt Taibbi articles to see how many times he uses the words  fuck   shit  etc. Today only one  fuck  surprisingly  and it was used as part of a larger word  clusterfuck.  You are getting soft Matt.
0.5887515281266074,YALL ACTIN LIKE I PUT THIS ON HERE. HAHA NIGGAS SOUND MAD CAUSE THEY KNEW ABOUT IT 10 YEARS AGO BUT NEVER THOUGHT TO MAKE A VIDEO FOR IT. DONT BE MAD AT ME MAN.\ \ THERE IS SOMETHING BEHIND THIS  SIGIL  CODE BUT YALL TO STUPID TO SEE AND READ.\ \ STICK U WATCHIN MUSIC VIDEOS ALL YOUR LIFE AND TALKING ABOUT PEOPLE. SEEMS LIKE ALOT OF YALL R GOOD AT THAT
0.5385227790530962,You are right. Do what you can while you can and hope to get to OCT and play your best ball. Like STL did.
0.5214239223951649,All you complainers  dont  forget that this is the SUN  a paper of Arse & Tits . If you dont like it. go  and read the Guardian . Love Lisa in the shiny gear.
0.5263183178201702,that is that has intensely fucked up.   the rampant misogyny is awful as well.
0.5339861238362759,kikwang isnt in the mv..or are you talking about something else?
0.8946161683024508,And those of us fortunate enough to know you silver....are eternally grateful for your mom instilling and passing on her strength fortitude and endurance to you my good friend.
0.5116842155035511,As soon as people gain celebrity status they think they are invincible. The way Tim Healy talks one would assume he is about 6ft 6ins. Well knock at least a foot off that. He must have a black belt at something  possibly bluffing.
0.678598101271376,I would say the same to you but from reading your posts it is it has easy to assume your gay
0.5222939268224015,Fuck it is it has starting to get scary. Soon Facebook will really become our Big Brother.
0.620699377586378,Are you...a girl?
0.7409990271910041,It is it has Tupac motherfucker. The Illuminati did not kill me and I am alive and well.
0.5527169507431128,I think he left from embarrassment though.
0.5632030700344283,Obama killed bin Laden.   Who do you want him to kill? Or why not just do it yourself?
0.7967724885523919,World without heterosexuality = A world without people World without homosexuality = A world without AIDS and gay pedophilia
0.6253876024899165,Wow you sound like me.  The first day back after my surgery I worked 10 hours.  We give overachieving a bad name I guess.  Take care of yourself OK?  And as for your therapist   fuck her.
0.7128061920470087,More like fucking goddess.
0.5182180660839147,no.  You are beautiful! :
0.6813314310039619,So Sorry  for your loss. God bless you and your family.
0.5584653905928797,It is you who is the confused one.  I do not hate anyone. no matter how screwed up I might think their views or lifestyle is unlike yourself.
0.714938813272539,If you want to know if your school is fucked see if it is it has on this list:
0.5096935338055947,How do you know she is not heart broken?
0.6711254097958756,I have been sayign that for years but the republicans somehow manage to not raise the taxes.. oh wait in MC you are charged 4% tax on FOOD.   How stupid am I... Fuck you republicans.
0.6017623071839369,Oh dear oh dear oh dear.  Did someone forget that bullshitting is frowned upon around here?
0.5678374807265929,Maybe Paul Ray should pay more for being a politician  aka liar reckless spender ass kisser idiot .\ \  Wonder which insurance provider he is doing?
0.5230622728877056,Hoping you are wrong about Gordon they could not kill the Comish!!!  :
