0.6700422627786603,@ian21  Roger Clemens is the fucking man and never did any fucking steroids because he is fucking awesome. Did you all misremember Roger's incredibleness?    Roger Clemens
0.5091125845013229,How about we accept facts and patiently wait for you to back up your claim.
0.5784883405991366,CNN supports HARCORE MASS MURDERING ISLAMIST TERRORISTS!!!!     Don 19t ever forget this guys!
0.5880058323006853,What is your problem AW
0.5596115198979589,Richards passes it to Carter.  Wow.  Surprising
0.5995499464475583,Koolnightie  You just like your bedmate Proud Marxist Shill are a deluded and brainwashed  useful idiot  of the Marxists who are doing their damnedest to bring down our society to Socialism.  There is no hope for you and your ilk.  I feel sorry for you.  When your Dear Leader Comrade  bama is voted out of office I expect that you will self destruct just like all of your Marxist heroes of the past.
0.5235183304141394,nah...that'd be your daughter
0.5624796457765248,So perfect!  LOVE to suck you!!!
0.5148134245700329,And you can be silly too!
0.6347280849532321,He is he has not spanking her he is he has fingering her asshole.  Hard enough to lift her off the ground.  Man I wish I worked with that dude.
0.5391578652494873,@Vojtass Go to a movie and have it start halfway through. Then smile complacently as the manager tells you you are la y and  im patient because you did not understand the full story.
0.6066252925997897,@foxrock66 Why would you throw something like Porn out there in the middle of your argument? Is really easy to judge that way. You are right I am just assuming. Because ding ding you make it come across that way. As for the wife thing. I gave an example on how it helps people. You keep talking about yourself. Hence why I think is you do not indulge as you put it.
0.6309542076642609,Start with impeaching this dumb ass usurper
0.7849673754533056,Who ever the fuck is going around saying I suck dick better run for their life. Imma set my dog on their ass.
0.8582342124720796,I have no problem at all throwing my good friend Crowley under the bus for this post because that fucker  I say that with love  has a whole act in his comedy routine detailing one of our  1cintimate moments. 1d Punkass. You had this coming Crowley.    Ahahahahahahahaha! That is that has what he gets for throwing an  OMGoodness boobs!  fit. IN LA!!
0.6984270948922688,Not right at all..... Schools have to make cuts but they can afford to pay a gay ass lunch police to look at are children's lunches screwed up way to screwed up..................
0.5023326188537173,christonastickJust  now There is no free speech here    Who prevented you from   posting this?
0.5231070787675087,You are far too generous in your comment about the odious Hamish Meldrum.
0.6030294507308078,WFHASDLGASEGFEAWOHDSHFLAWEFSDHF..SFOAWEHGASD HOLY FUCK.. DPIAHSGPA..I CAN'T EVEN ..  61   THE RETURN OF THE SUPERIOR. 13 2 FOREVER
0.8107579431145738,It is it has the marketing change not OMM. DO looking for a reason to blame some christian group so they can keep living in a boogey man fantasy world.  GCB and Playboy club were cancelled because the shows fucking sucked. I gave both a try and both were absolutely terrible. Modern Family has a prominent gay couple and it does just fine on TV. And then there is there has Glee. Where is where has the mysterious power of OMM regarding those two?  CEOs get fired for one reason only ever period: MONEY. Not making stockholders happy? You are fired.  C'mon DO y'all can do better than this shit.
0.5114338742971377,Because you troll to much.
0.5417894032393817,You know I have read your comments on here and can clearly tell that you are a sympathi er for those who kill children women and others who cannot defend themselves.  Piss on Bin Laden piss on Mohammed Merah and piss  on you and your progeny you SOB!
0.554457030186739,You must have a very hot temper. I see you are losing your temper because you cannot stand the truth?
0.5095660174212042,Holy shit. I want to do this but I fear that it would prevent me from y'know getting a job.
0.7403206664638202,Holy shit you are right!
0.7130366448952892,Yours is jacked
0.734792890169112,how fucking DOPE
0.6713213752883194,Peados  whores men who batter women and now stalkers who also indulge in a bit of child porn  what happend to vetting contestants    will it have live oap sex next week as that is all its missed so far
0.533318023611358,I have a fucked up brain.   This song just popped into my head.
0.519515997269584,and then they were like...  oh shit how the hell are we getting down from here?
0.5671383224369468,Fuck this show .
0.5757103155416441,What a piece of crap you know he will screw wawa or anybody else to make a nickle
0.9586732319637826,No shane dies dammit u have 2 admit it shane wu  d life of d show btw darly and d sheriff they kept dis show interesting but witout dem 3 dis show would not last 2 long becu  lori a slut and always starting shit wit her houes wife ass we got a bitch who always cing killing herself a option and wants 2 b a guy and carl is just fucking stupid he came from we want 2 c him survive d gunshot dat almost killed him 2 y dis little bastard start acting weird and bing annoying and shit
0.6100109000115976,Your comment shows how absolutely little you know
0.5922645601284853,Honestly Anons are the Fight Club of the Internet but fucked up to unimaginable extremes Do not fuck with us.
0.586936380364264,Thank you very much
0.5845076516323309,Somebody owes you a refund.
0.8249951442776952,FUCK ALL U PUSSY AS  CRACKERS
0.7914666108565002,This whole shit go hard! I wish Maxx was on the hook!!! Fuck what the rest of yall niggas talking. I like the plot of the story yall niggas need to pay attention more and hate less. Get the fuck of the computer and make your own video if you can do better. If not STFU!!!
0.5583358189387065,You ain't a troll bro
0.8062721147633364,I fucking love your username
0.5338944025356529,Rubio has been bought and payed for by the Kochs. You have to be stupid thinking because he is he has latino that he wont crap on you like any other GOP...
0.7357782354493356,Fucking idiots. They should all be in jail. Make things worse for all of us responsible and respectful cyclists.
0.5314896387643683,Nobody understands why you are a Paulbot probably not even Ron Paul.
0.5062187326034435,So disappointing. What an ass. Hollywood actors and singers have turn it into a town of druggies. They deserve their fate.
0.6869329423143622,You say that Marriage is a divine institution. Let me just crack open my King James Bible here and see what it has to say. \ \ In Genesis 2:24 I must stone my bride to be to death if she is not a virgin on her wedding night. Also cannot marry outside my faith so best put that on the books as a legal requirement for marriage.Deuteronomy 22:28 29 I could just rape a woman pay her father 30 silver and she is compelled to marry me. Quick we need to add exemptions to our sexual assault laws so that we allow for rapist victim marriages.\ \ \ \ I could follow in the footsteps of Abraham Caleb Jacob and Solomon and take concubines as blessed by God.\ \ OR instead of claiming that your biblical view of marriage is the ONLY justified view you could allow for other interpretations in our laws. Such as equality and common sense.\ \
0.5889178833460065,Why even enter if you knew you are not good with freestylling w/o your notebooksad thing is lyrically he better than 50% of these bum ass rappers....
0.6643481961642069,Of course he fucking wants Harrison Ford. And Harrison Ford better fucking want him after his last 20 years of choices.
0.5713674559648861,Man not for nothing but them niggas was wack last night sung like four song and lefted. From the dude wit da spikey jean vest...
0.5244449723124978,Who the hell are you to judge? Must be one of those who casts the first stone. Your NWO will fail period. You just do not know it yet opps now you do.
0.7801338901840578,Great another one. Really we\ \ do not\ \ need any more of this crap. Your life sucks. People judge you. Good job go tell your mom not the internet. We. Do not. Care. Same with the stupid anti religious\ \  or conversely\ \ religious  posts on dbpb. Okay so you do not think that abortion is bad. Okay then. You do not need to shout it out to the world. Just like you do not think\ \ religion\ \ should exist that it is it has evil ect. Yeah yeah God bless ya we do not need to hear it on this site. All it does it annoy people and start flame wars. Only thing flame wars are good for are to roast marshmallows.\ \ \ Sorry guys I think I am on some sort of man period  . \ \ Off topic: Anyone else love Blackbird by the Beatles?
0.5103251201032687,Run along to your Klan meeting now hoodie. The truth is that TODAY Democrats refuse to provide good educations to minorities and inner city children. You can bang that  the partys have switched  drum all you want. BUT HERE IN THE 21ST CENTURY DEMOKRAUTS STILL DON\\'T TREAT MINORITIES VERY WELL BASED ON THEIR DENIAL OF QUALITY EDUCATIONS. PERIOD....AND THOSE MINORITIES ARE WAKING UP TO YOUR PARTY\\'S LIES A LITTLE MORE EVERYDAY!
0.5191250202226991,How dare you say such a hateful thing!
0.6741146741240145,You will you shall be bloody miserable though!
0.5535720296317959,I personally do not give a toss about Palin she is now just a media whore  LOL she obviously lives in your head
0.5481362702788213,Like you for slander!!
0.5805591437031992,I know you are speechless when you hear the truth.
0.6573498704698065,does not matter who you are you could be jay   or nas or dr dre who ever if you fuck up long enough then do some shit like this your no longer a legend period lol
0.6790729390578863,@avclub e576423831e043f7928d9ac113abbe6f:disqus   I fucking predicted it last week.  Which means I am better than the showrunner for this show  and so are you!
0.5112796745312391,When you get depressed look at your beautiful water and your beautiful men!
0.5252884798125118,@NCSteve 3.0 @dopper0189\ \  If I could dry hump your post I would
0.5411102437689406,Name me one really decent person in the union wing of the parliamentary labour party.  Someone who you would value as a good neighbour or seek help from. Yeah there is there has some clever bastards there but most have been rejected by their electorate and have been shoe horned in on the list or given an absolute sinecure of a seat.
0.6419254037899639,What a fucking joke!
0.624985555902522,I do not think we have a shitty team.
0.5884577761285669,I feel like some poor bastard saw this news report and went  Oh fuck me they went digging there 3d
0.5109181386292245,\ \ Because we agree that Obama Gingrich Romney and Santorum are ALL wrong and we should not be sticking a stick in the hornet's nest. We may be able to blow the nest to bits but the individual hornets are going to lite your a55 up. Best not to poke the hornet's nest even if you can. It just ain t worth it. If the hornets leave you alone then leave them alone. Wisdom comes with age sometimes.
0.6459113129944111,What is what has  fucking pathetic  is considering anything you are politically opposed to as  tyranny.
0.5432759800768889,ac tro gi ma hay va kho the fuck
0.5468836550323618,I would gladly spend a few days in jail to be able to punch each and every one of those little fucks in the face and knock out a tooth or two.
0.5288416936322026,Thank you again Adam and John.  K bye
0.6352088082348861,Only if you are.
0.7115107522463681,I bet this is the most action OC weekly ever got cause there dumbass bitches who aint got any stories to report! OC WEEKLY TAKES IY UP THE ASS  Love Gabriel San's Mom
0.6145239017334247,what are your picks?
0.5194532593028262,@adrian It is it has funny when I hear TeaChoads talk about voting for Newt. It does not annoy my it entertains me. Like a monkey playing with his poop or a dog eating it is it has own vomit.
0.5761935989962046,@ericA  Maybe they have decided that redefining incest and date rape as consensual sex would be received better by the general public?
0.5372938868385726,butt scales sound like a big problem.  You all should go see your doctors and get treatments for that.
0.546101162554245,Get rid of this fuckin player pl  so slo
0.5070194270347299,@Kick Ass Suuuure you will. Because you know all the places in L.A. hiring an accomplished sound designer/audio engineer/editor.
0.7021121491376747,how can you call African Americans and white Americans stupid??..and we are not shown the so called  expensive  clothes they wear..i mean it is it has not our fucking fault..i mean shit all i see on t.v. and the internet is what i see!!!..it is it has not our fault..and also it is it has not that fucking serious!!
0.5398417457437366,You never saw 'Animal House'?........
0.6548602150187567,ok. Off you go.
0.5389788512967927,Like your pictures.  Follow?
0.7831034919876694,@Rourke needs to give me a fucking like  @LambeauOrWrigley  @aciddragon    Reesy's thermos dented?  Reminds me of a killer line from  Horrible Bosses .... Jennifer Anniston's horny dentist character reports watching some beefcake guy on TV and  ... fingering  her self so hard  she  broke a nail.
0.6287809261659059,@PassTravelFool suck it republiklans
0.6007931168790314,They are against abortions in the case of rape because Jesus was conceived by God raping Mary.
0.7449848071565903,Nothing like imitating a sex offender for laughs.  Ha ha!  I might be a rapist.  Asshole.
0.5711148741097196,Prove your AMERICAN and you can vote all you want.    Get it?
0.5110127296687651,Let me ask you a question.....you like fishticks?
0.5416175010035954,Scandalous? \ \ So illuminating. \ \ So profound.\ The.sour.kraut must expect that anybody that listens to him will just accept his conclusions without presentation of any objective analysis.\ He is correct that is all anybody who believes in the pretentious pundit needs. \ \ He knows that there are lickspittles about that suck up his swill.
0.5134707843496837,how are you a fan of 3 football teams?
0.7549291420031539,MAN FUCK THE POLICE WE NEED TO START A RIOT ON THEY ASS
0.562512871595887,You go from absurd to moronic.
0.7233340035946755,lack of reality lmao like seriously are u fucking kiddin me. we got married is nothing but FAKE! this is reality here ji hyun woo and yoo in na! so mbc we got married psycho fans get real! an mbc come up with a real reality show!
0.6242369947324086,You know because you are an expert drunk?
0.5300998239939639,We are looking for leadership from Grayson.  Leaders   Scott Shackleton Churchill and even Revie will persevere and generally prevail whatever the adversity.  SG still has a lot of advantages other Championship managers would kill for.  He should not be overcome by despondency.  His body language which has never been good IMO was particularly poor on Saturday.  He needs to get a grip.
0.5847430445888449,@faustshausuk sad.  And just like that you fucked up.  Apple....Apple.  You sir need to do some research on your friend Apple when it comes to hardware. LOL!
0.5209892375017017,@mahstah  @MaddHatter  @shooter  CARTER method Come  in  after richards then enter rear
0.6670357847324355,Repost: I have reread this blog article and feel the need to repost it:   Massacres Never Again  We Will Not Silence
0.5193502260161357,You are just plain wrong.
0.5739718305591252,\ \ David Brock homosexual militant who obviously hires other homosexual militants to rag on Fox News because Fox News exposes them for what they are. Daily Caller may not be able to say it but I will.\ \ In his autobiography Blinded By the Right: By David Brock\ \ \ \ At Berkeley I had no cause to associate conservatism with prejudice against gays. In the early \ \ \ 80s gay issues weren\ \ \ t polari ing our campus\ \ \ since arriving in Berkeley I no longer put aside my deeper desires. With some hesitation during my freshman year I went on uneasy dates and had hurried sexual encounters with other guys in neighboring dorms. By the end of the year I considered myself gay and had surprisingly little trouble accepting that reality\ \ \ .\ \ \ \
0.6207641916188711,Who do you think assisted him with the Olympics in Salt Lake?
0.5578435994112161,I do not know why you people think AMERIKKKA will change cause it will not it is it has always been a racist fucking country and racism will be it is it has down fall remember these words.
0.5644728027399646,lol who are you rooting for??
0.6589543221697283,You seem obsessed with gay sex......seek help
0.5333760937083125,when the fU cK are we getting some new footage. fuck this shit
0.5112538306685762,you do not have to comment when you are high !
0.6084752542415963,Maher is an idiot.. and you are too if you defend his stupidity
0.5482790147784791,No matter how old you get she thinks about you and worries....and prays for you.
0.8494025589370816,why niggas slappin bitches ass nowadays smh we punchin bootys were im from bruh
0.6532045608073819,@Rourke needs to give me a fucking like how sad is it that this song makes me think of the California Raisins?
0.5526814133995444,One Pimp & One Prostitute both smell very nasty
0.6262259879358301,GO YOU CHICKEN FAT GO!
0.5216675693879674,Well after all Rmoney DID hire a speechwrighter/debate coach who worked for Jerry Falwell.  What would you expect?  Truth?  Believability?  Accuracy?  Honesty?  From Rmoney?  Puhlee e!
0.5368366633873968,Dre WTF are you doing not even close
0.700247087190784,You know there are people who still have not seen  Prometheus  right? The fucker's only been out for one weekend.
0.5859750049642447,@Rourke needs to give me a fucking like  @aciddragon well its me and my friend Jawn.
0.5285970294267559,LMAO...you know only I will get that fag joke...bahahah... and before anyone blasts Johnny it is a brand of bearing FAG swear to god   It is it has ok though if they fuck with me they are leaving some other poor soul alone.    My son is doing great his ship is due for its first deployment this month...  we are gonna go up to Norfolks when it returns for the big hoopla for it next spring.  Been pretty busy here too.  Sure have missed ya around here for sure.
0.8335874472283265,LOL Allen Iverson was right he told Lebron people was gonna hate him.Jealous ass pussy fucks say what you want about him.He is he has in the finals and you are behind a computer scratching   your nuts.Know your place.BTW Okc vs Heat is gonna be a good ass game.
0.5470884303437804,This piece of human excrement is certifiably insane ... she is he has so full of crap she needs to go to the bathroom.  The people who put her in office must enjoy enriching her and her husband at their expense ... they are bottom scum that feed off of the crap from this Benedict Arnold
0.5193502260161357,And you are meet example.
0.7697170295992252,Gee Mitch.   As I recall you and Boner would not bargain with the president when he offered a $4 billion deal that would have had a tiny tax increase on the 1%.  You blew it.  I hope you and Boner get driven from office.  You have fucked up the economy for your own greedy political gains.
0.7536938080135392,Oh shit there is there has more !   Fucking perfection lmao !
0.5361926462018014,So much win in your comment
0.5193502260161357,why you gotta trash Cali?
0.9118904885977551,There is one Judge and He is over all He is the one who calls sin what it is and tells us to repent of it. Homosexuality G d calls it an abomination it is detestable to Him and it should be to us. G d did not create killers muders rapists pedophiles lesbians gays transgender adulterers thieves fornicators etc. Your logic fails when you say that the Creator made them this way for a reason that is an evil position to hold. We make choices in this life and what we become is all based upon our own individual freewill no one forces them to become rebellious against G d they have done it to themselves. In your trying to have others accept evil to create peace what you are actually doing instead is creating chaos because righteousness and evil rebelliousness cannot co exist.
0.5018156682218043,@Blue Grit Oh they have already started that campaign.  Didn\\\\\\'t you see Juan Williams get  put in his place  at one of the debates?  The base ate it up and Newt shot to the top of the polls.  Unfortunately David Axelrod was right:  The higher the monkey climbs the more you see of his ass.
0.5981597297724083,I thought a peep was those marshmellow things we eat around easter time?\ \  lol\ \  But on a serious note this millionaire is an idiot.\ \  Research the area where you are going to build a mansion first and second if you get robbed there are local people 700 yards to protect your rich ass.
0.5116502088212533,Ra or2myWrist... when will you take that ra or there?  Hopefully soon.  You are a major moron.  When HE calls you home HE will call you home.  I am sure that HE did not let Patrick suffer.  Prayers and condolences for those he left behind.
0.5710270227948749,Looks like You Sarah!
0.5848938089383664,GET YOU HEAD OUT OF YOUR    A      !!!!!!!!!!!
0.5992987637953009,What does that mean? Does that mean all languages are equal? Are you retarded?  To write good code in PHP takes an enormous amount of knowledge of all the inconsistent and unorthogonal crap that is in PHP and vast amounts of time and not a little luck.
0.5540184279948219,@Wild Willy Thank you for this link. It proves that Komen is  pure political manipulation with no interest in helping humans it pretends  to help. BS at it is it has highest level of stinking and sucking.
0.6117113676531167,An incompetent pos that nobody should be burdened with. Start the criminal proceedings
0.6464217071322685,Bravo Bev kill em with facts.  Very well put.  People like Jane who brag about the fund raisers they have or attend for the likes of Babs Boxer thier rich husbands and the top colleges that their children attend make me want to puke.  They have no concept of anything outside the relm of their own closed neighborhoods.   Jane like other token liberals in this forum all wear rose tinted glasses and the sun always shine on them and their neighborhood.  Jane would not last a single day in a neighborhood as you described it.  Sad so darn sad.  Pops...
0.6413391289500301,This is what happens when you fuck dirty dudes you just met at the bowling alley.
0.94426449299485,Ben Richards have you seen your mom or your granny titties cause she only show a nipple.I guess when your wife gets 60 you will you shall stop looking at her titties too.
0.6845273363653911,To those of you who think defense lawyers are scum   hopefully you will you shall never need one on your side.
0.8541301041041541,Fuck The Great Gatsby.  I am sorry that book sucked ass and the movie will suck even more.   You know what I am NOT sorry. I hate that book as much as fucking Terry Tempest Williams who  whom?  I had to read in college.
0.5109377774452794,Gee if only it were possible for you to start your own blog instead of telling Atrios how to run his . . . .
0.5161077377909289,Eli abeth was a paranoid despot   with good reason   who employed a secret police to root out dissent and the punishment was often death. I see you are a bit fan of piracy   commerce  as that was all the rage at the time as was  profiteering from the slave trade. Times do not change that much and the ripples of our former exploits still laps into modern times.
0.6135493973405548,I am betting I will get an overwhelming amount of hits from Right Wing NRA members blogs promoting the fear without any real substantiation basically quoting each other to prove they are right like some massive circle jerk.      It is simple: Do you think the majority of the military forces including the national guard and armed reserves would turn their weaponry on American citi ens at home  Their mothers fathers brothers sister and friends at the say so of any President.  You do not control the military you have nothing. MIght as well pee into the North Dakota wind because the takeover you all are fearing is hysteria and hysterical if not down right paranoid........unless you sneaky bastards..... you are trying to get into control with all you weaponry to takeover the gov't setting up you own totalitarian states..  It is like you rant about Muslims that they are taught to lie......Everything is geared to 2As  to come to power.......OMG I am becoming paranoid and delusional  you sneaky sneaky 2As.
0.8296861580112113,Like you?
0.5020662284609215,Come on Simon  throw the trash out  she is he has ruining your  show .  Dump the bitch!!
0.5455769777451072,\ \ Popes Gone Wild: What the Catholic Church Would Rather You Forget\ \ \ \ Pope John Paul II our current pope was also part \ of H itler's Youth. This would probably disqualify him for political \ positions if he went that route instead of the papacy. Though he is he has \ publicly condemned all forms of birth control and gay marriage his only\  reaction to the pedophile priest scandals was merely to issue a feeble \ apology for 2000 years worth of pedophile church swapping record \ burying and secret payoffs to families for not denouncing the church \ publicly. He never condemned the behavior and only started defrocking \ priests when the masses started to put intense pressure on him to do so.\  Even so not that many priests were let go compared to what are likely \ out there. Apparently pedophilia is a more forgivable sin then birth control.
0.5686580571760984,\ \ well  you piss off black people comparing that to gay marriage  but thats there problem
0.5176377464994811,when you are slaves you do not make demands time for a revolution
0.715883922808629,you fuck there heads
0.611205374958648,@Rourke needs to give me a fucking like  @LambeauOrWrigley  @SDL    Huh? No mainly that other people on here ridiculed you mercilessly.
